{
  "stack": "agentic-ai-engineer",
  "week": "w01",
  "version": 1,
  "reviewed_by": "Codex placement coverage review, 2026-10-12",
  "lessons": [
    {
      "lesson": "w01-l01",
      "count": 5,
      "essential_concepts": [
        "assignment-binds-names",
        "identity-vs-equality",
        "mutable-default-argument",
        "shallow-vs-deep-copy"
      ],
      "questions": [
        "w01-l01-q01",
        "w01-l01-q05",
        "w01-l01-q08",
        "w01-l01-q09",
        "w01-l01-q11",
        "w01-l01-q12",
        "w01-l01-q13",
        "w01-l01-q14"
      ],
      "rationale": "Identity and equality, name binding and mutability, default-argument lifetime, and copy depth cover the object-model objectives and their common bugs."
    },
    {
      "lesson": "w01-l02",
      "count": 5,
      "essential_concepts": [
        "closures-and-nonlocal",
        "late-binding-closures",
        "legb-scope",
        "parameter-kinds"
      ],
      "questions": [
        "w01-l02-q01",
        "w01-l02-q02",
        "w01-l02-q03",
        "w01-l02-q06",
        "w01-l02-q07",
        "w01-l02-q09",
        "w01-l02-q11",
        "w01-l02-q12"
      ],
      "rationale": "LEGB lookup, nonlocal closure state, late binding and parameter kinds cover callable behavior, capture and API argument boundaries."
    },
    {
      "lesson": "w01-l03",
      "count": 5,
      "essential_concepts": [
        "decorator-basics",
        "decorator-stacking",
        "decorators-with-arguments",
        "functools-wraps"
      ],
      "questions": [
        "w01-l03-q02",
        "w01-l03-q03",
        "w01-l03-q05",
        "w01-l03-q07",
        "w01-l03-q10"
      ],
      "rationale": "Decorator transformation, metadata preservation, argument-bearing factories and stacking order cover callable wrapping; caching is studied as an application of these boundaries."
    },
    {
      "lesson": "w01-l04",
      "count": 5,
      "essential_concepts": [
        "generator-functions",
        "iterator-protocol",
        "lazy-evaluation-memory",
        "yield-from"
      ],
      "questions": [
        "w01-l04-q01",
        "w01-l04-q03",
        "w01-l04-q05",
        "w01-l04-q08",
        "w01-l04-q10",
        "w01-l04-q11"
      ],
      "rationale": "Iterator protocol, generator suspension, yield-from delegation and lazy memory behavior cover iterable pipelines and streaming foundations."
    },
    {
      "lesson": "w01-l05",
      "count": 5,
      "essential_concepts": [
        "context-manager-protocol",
        "contextmanager-decorator",
        "dataclass-options",
        "dunder-methods"
      ],
      "questions": [
        "w01-l05-q01",
        "w01-l05-q02",
        "w01-l05-q03",
        "w01-l05-q05",
        "w01-l05-q06",
        "w01-l05-q07",
        "w01-l05-q10"
      ],
      "rationale": "Context-manager entry/exit, generator-based context managers, dunder behavior and dataclass options cover scoped resources and Python object protocols."
    }
  ]
}
